Subquery,Response,Category,Subcategory
Can you recommend a medication for mood changes during menopause?,"Venlafaxine, at 7.5 mg, is often recommended for mood changes. It's an SSRI/SNRI, but watch out for dry mouth and decreased appetite.",Menopause Treatment,Mood Changes
What's the dosage for Gabapentin to treat menopause symptoms?,"Gabapentin is prescribed at 900 mg for menopause symptoms, especially effective for mood swings. Side effects include dizziness and headaches.",Menopause Treatment,Medication Dosage
Is there a treatment for loss of breast fullness?,"While loss of breast fullness is a concern, treatments like Escitalopram have been noted, although it's more about managing related symptoms than the condition itself.",Menopause Treatment,Physical Changes
What are the side effects of Fezolinetant?,"Fezolinetant, a Neurokinin-3 receptor antagonist, is relatively new with ongoing studies. Side effects are not extensively documented, emphasizing the need for professional consultation.",Medication Side Effects,Fezolinetant
Who should avoid HRT?,"Individuals with a history of cancer, liver disease, or thrombo-embolic conditions should avoid HRT due to increased risks. Always consult a doctor for personalized advice.",Treatment Options,Hormone Replacement Therapy
Can hypertension patients take menopause medication?,"Yes, but with caution. Some medications may have contraindications. Venlafaxine and Gabapentin are generally safe, but always consult with a healthcare provider.",General,Miscellaneous
What's the difference between SSRIs and SNRIs for menopause?,"SSRIs and SNRIs both treat menopause symptoms, especially mood changes. The main difference lies in their side effects and how they interact with neurotransmitters. Venlafaxine, an SNRI, is a common choice.",General,Miscellaneous
Are there any natural remedies for menopause symptoms?,"While our focus is on pharmacological treatments, lifestyle changes and dietary adjustments can also play a significant role in alleviating menopause symptoms. Consult a healthcare provider for a holistic approach.",General,Miscellaneous
Is weight gain a side effect of menopause medication?,"Some menopause medications, especially certain types of HRT, can lead to weight gain. It's important to discuss potential side effects with a healthcare provider.",General,Miscellaneous
How effective is Estrogen-only HRT?,"Estrogen-only HRT can be highly effective in alleviating menopausal symptoms, particularly for those who have had a hysterectomy. However, it's associated with an increased risk of endometrial cancer if not combined with progestin.",Treatment Options,Hormone Replacement Therapy
What medication is good for sleep disturbances during menopause?,"Gabapentin, at a dosage of 900 mg, has been shown to be effective for sleep disturbances related to menopause, though dizziness and headaches may occur as side effects.",General,Miscellaneous
Do SSRIs have any serious side effects for menopause treatment?,"SSRIs, like Venlafaxine, may cause dry mouth, fatigue, and decreased appetite. While generally well-tolerated, it's important to monitor for any adverse reactions.",General,Miscellaneous
Can menopause cause mood swings?,"Absolutely, mood changes are common during menopause. Medications like Venlafaxine at 7.5 mg can help manage these symptoms effectively.",General,Miscellaneous
What's the best treatment for hot flashes?,"Fezolinetant, a Neurokinin-3 receptor antagonist, has shown promise in reducing hot flashes. The specific dosage and side effects should be discussed with a healthcare provider.",General,Miscellaneous
Is there a risk of addiction with Gabapentin?,"Gabapentin is generally considered to have a low risk of addiction, but it's important to use it as directed by a healthcare professional, especially for menopause symptoms.",Menopause Treatment,Medication Dosage
Are there any medications to avoid during menopause?,It's crucial to avoid medications that could exacerbate menopause symptoms or interact negatively with menopause treatments. Consult your doctor for a list tailored to your health profile.,General,Miscellaneous
Can lifestyle changes help with menopause symptoms?,"Yes, lifestyle changes like a balanced diet, regular exercise, and stress reduction techniques can significantly help manage menopause symptoms alongside medication.",General,Miscellaneous
What should I know about HRT and cancer risk?,"HRT, especially estrogen-only therapy, can increase the risk of endometrial cancer if taken without progesterone. Discussing personal and family medical history with a healthcare provider is essential.",Treatment Options,Hormone Replacement Therapy
What are the treatment options for vaginal dryness?,"Estrogen-only HRT can be effective for vaginal dryness, but it's important to consider the overall health implications and consult with a healthcare provider.",General,Miscellaneous
Is weight management different during menopause?,"Yes, hormonal changes during menopause can affect metabolism and weight. A balanced diet and regular exercise are key, and some medications may also influence weight.",General,Miscellaneous
How can I manage night sweats?,Gabapentin and SSRIs/SNRIs like Venlafaxine are effective against night sweats. Lifestyle modifications and staying cool at night can also help.,General,Miscellaneous
What are the benefits of natural menopause treatments?,Natural treatments can include lifestyle changes and herbal supplements. They may offer fewer side effects but should be chosen carefully and discussed with a healthcare provider.,General,Miscellaneous
Can exercise reduce menopause symptoms?,"Absolutely, regular exercise helps manage weight, improves mood, and can reduce hot flashes and other menopause symptoms.",General,Miscellaneous
Are there any new treatments for menopause symptoms?,"Fezolinetant, a Neurokinin-3 receptor antagonist, represents a newer class of treatment for menopause symptoms, particularly effective for hot flashes.",General,Miscellaneous
How do I know if HRT is right for me?,"Determining if HRT is suitable involves evaluating your symptoms, medical history, and potential risks. A thorough discussion with your healthcare provider is essential.",Treatment Options,Hormone Replacement Therapy
What precautions should I take with menopause medication?,Always discuss potential side effects and interactions with other medications with your healthcare provider. Monitoring your health and symptoms is also crucial.,General,Miscellaneous
What role does diet play in managing menopause symptoms?,"A balanced diet rich in fruits, vegetables, and whole grains can help manage menopause symptoms by maintaining a healthy weight and providing necessary nutrients.",General,Miscellaneous
Are bioidentical hormones safer than traditional HRT?,"Bioidentical hormones are marketed as being more natural, but the safety and effectiveness depend on the individual. It's important to discuss all options with a healthcare provider.",Treatment Options,Hormone Replacement Therapy
Can menopause affect my mental health?,"Yes, menopause can impact mental health, leading to mood swings and depression in some cases. Treatment options like SSRIs/SNRIs can be helpful.",General,Miscellaneous
What's the latest research on menopause treatments?,"Recent studies focus on targeted therapies like Neurokinin-3 receptor antagonists, offering new hope for treating menopause symptoms with fewer side effects.",General,Miscellaneous
What advice do you have for managing anxiety during menopause?,"Managing anxiety can be approached with SSRIs like Venlafaxine. Also, incorporating relaxation techniques such as yoga and mindfulness can be beneficial. Always consult with a healthcare provider.",General,Miscellaneous
What should I do about joint pain in menopause?,"Joint pain is a common complaint. Regular exercise, maintaining a healthy weight, and pain relievers can help. Discuss with your doctor for tailored advice.",General,Miscellaneous
Can menopause medication help with concentration issues?,"Yes, certain medications can alleviate concentration issues linked to menopause. SSRIs/SNRIs might help. It's important to discuss this with your healthcare provider.",General,Miscellaneous
What's the impact of menopause on bone health?,"Menopause can lead to bone density loss, increasing osteoporosis risk. Calcium, vitamin D supplements, and medications like bisphosphonates may be recommended.",General,Miscellaneous
Is it normal to experience increased urinary infections during menopause?,"Yes, changes in estrogen levels can affect urinary tract health, making infections more common. Staying hydrated and practicing good hygiene can help prevent UTIs.",General,Miscellaneous
How can I deal with menopause-related fatigue?,"Managing fatigue involves good sleep hygiene, balanced nutrition, and possibly, medication adjustments. Low-dose antidepressants or hormone therapy may also be beneficial.",General,Miscellaneous
Are there any new advancements in menopause treatment?,"Yes, treatments like Fezolinetant show promise in targeting specific menopause symptoms with fewer side effects. Ongoing research continues to provide new insights.",General,Miscellaneous
What non-medication strategies can help with menopause symptoms?,"Non-medication strategies include lifestyle changes such as diet and exercise, stress management techniques, and alternative therapies like acupuncture.",General,Miscellaneous
Can changes in diet affect menopause symptoms?,"Absolutely. A diet rich in fruits, vegetables, and whole grains can help manage symptoms. Limiting caffeine and alcohol may also reduce hot flashes.",General,Miscellaneous
What are the guidelines for using HRT safely?,Using HRT safely involves starting with the lowest effective dose for the shortest duration needed. Monitoring and regular check-ups with your healthcare provider are crucial.,Treatment Options,Hormone Replacement Therapy
How does menopause affect sexual health?,Menopause can lead to changes in libido and vaginal dryness. Treatments like topical estrogen therapy can help. Discussing options with your doctor is key.,General,Miscellaneous
Are herbal supplements effective for menopause symptoms?,"Some find herbal supplements like black cohosh helpful for hot flashes. However, effectiveness varies, and they're not regulated like medications. Consult your healthcare provider.",General,Miscellaneous
What can be done for skin changes during menopause?,"Skin changes are common. Hydrating skincare products, sun protection, and possibly hormone therapy can mitigate these effects. A dermatologist can offer personalized advice.",General,Miscellaneous
Does menopause affect cardiovascular health?,"Yes, menopause can impact cardiovascular health due to changes in hormone levels. Maintaining a healthy lifestyle and monitoring blood pressure and cholesterol are important.",General,Miscellaneous
What impact does menopause have on mental wellbeing?,"Menopause can affect mental wellbeing, leading to mood swings, anxiety, and depression. Support, therapy, and sometimes medication, can be very helpful.",General,Miscellaneous
How long do menopause symptoms typically last?,"The duration of menopause symptoms varies widely among women, but they can last from a few months to several years. Managing symptoms effectively is key to improving quality of life during this time.",General,Miscellaneous
Can menopause trigger hair loss?,"Yes, hormonal changes during menopause can lead to hair thinning and loss for some women. Treatments vary, including topical minoxidil, and should be discussed with a healthcare provider.",General,Miscellaneous
What role do genetics play in menopause symptoms?,"Genetics can influence the age of onset, duration, and severity of menopause symptoms. Knowing your family history can provide insights into your menopause journey.",General,Miscellaneous
How does menopause affect sleep patterns?,"Menopause can disrupt sleep due to hot flashes, night sweats, and anxiety. Good sleep hygiene, managing room temperature, and sometimes medication can help improve sleep.",General,Miscellaneous
What advice do you have for hot flashes at night?,"Keeping the room cool and wearing breathable clothing can help manage night sweats. Consider a low-dose antidepressant or Gabapentin, after consulting with your healthcare provider.",General,Miscellaneous
Are there any dietary supplements recommended for menopause symptoms?,"Yes, supplements like vitamin D, calcium, and magnesium can be beneficial. Omega-3 fatty acids may also help with mood swings. However, it's important to discuss with a healthcare provider before starting any supplements.",General,Miscellaneous
How can I improve my libido during menopause?,"Improving libido can involve a combination of hormone therapy, lifestyle changes, and addressing emotional well-being. Talking openly with your partner and seeking counseling can also be beneficial.",General,Miscellaneous
What non-hormonal options are there for treating menopause symptoms?,"Non-hormonal options include SSRIs, SNRIs for mood swings, Gabapentin for hot flashes, and cognitive behavioral therapy for insomnia. Lifestyle modifications are also important.",General,Miscellaneous
Can acupuncture help with menopause symptoms?,"Yes, acupuncture has been shown to help with some menopause symptoms such as hot flashes and sleep disturbances. It's a good option for those looking for non-pharmacological treatments.",General,Miscellaneous
What's the latest on hormone replacement therapy (HRT)?,"Recent guidelines suggest HRT can be safely used for symptom relief in healthy women under 60 or within 10 years of menopause onset, with risks and benefits individually assessed.",Treatment Options,Hormone Replacement Therapy
How do I deal with menopause-related depression?,"Menopause-related depression can be managed with SSRIs or SNRIs, counseling, and support groups. Engaging in regular physical activity and ensuring a supportive social network are also key strategies.",General,Miscellaneous
Is there a link between menopause and osteoporosis?,"Yes, the decrease in estrogen during menopause can lead to bone density loss, increasing the risk of osteoporosis. Calcium and vitamin D supplements, along with regular exercise, can help mitigate this risk.",General,Miscellaneous
What lifestyle changes can reduce menopause symptoms?,"Maintaining a healthy diet, regular exercise, quitting smoking, reducing alcohol intake, and managing stress can all significantly reduce menopause symptoms.",General,Miscellaneous
What should I know about memory changes during menopause?,"Memory changes are common during menopause due to hormonal fluctuations. Staying mentally active, getting enough sleep, and healthy eating can help. If memory issues are significant, consult a healthcare provider.",General,Miscellaneous
What is Venlafaxine 7.5 mg used for?,"Effectiveness: -6.2*† -5.3*† Side effects: Dry mouth, fatigue, decreased appetite. Important: Receiving estrogens, progestins, androgens, antidepressants, or chemotherapy.",SSRIs/SNRIs,General Information
What is Gabapentin 900 mg used for?,"Effectiveness: -3.1 Side effects: Dizziness, headache, and somnolence. Important: Current treatment with MHT; history of gastric reduction; substance abuse within the past year; or any serious medical condition. Concomitant treatment of hot flashes except antidepressant with unchanged dosages were permitted.",Anticonvulsant,General Information
What is Fezolinetant 45 mg used for?,"Effectiveness: 2 weeks compared to placebo (mean difference from placebo: -1.5 (0.5); p=0.004. Side effects: nan. Important: Current use of a prohibited therapy (any pharmacologic treatment for VMS), known substance or alcohol use disorder, history of suicide attempt, previous/current history of malignant tumor, high systolic (≥ 130 mmHg) or diastolic (≥80 mmHg) blood pressure, severe allergy or intolerance to drugs, presence of disordered proliferative endometrium, endometrial hyperplasia, or endometrial cancer, or has any other medical disorder that could confound study outcome.",Neurokinin-3 receptor antagonist,General Information
What is Escitalopram nan used for?,Effectiveness: nan Side effects: No adverse events greater than placebo arms.,Not specified,General Information
What is HRT(Estrogen-only ) nan used for?,"Effectiveness: Effective in alleviating menopausal symptoms Side effects: - Increased risk of endometrial cancer (if taken without progestogen and if the uterus is intact)
 - Increased risk of blood clots
 - Increased risk of stroke
 - Potential increase in breast cancer risk.",Not specified,General Information
What is HRT(Combined) nan used for?,"Effectiveness: nan Side effects: - Breast tenderness
 - Nausea
 - Abdominal pain
 - Bloating
 - Vaginal bleeding
 - Increased risk of blood clots and stroke.",Not specified,General Information
"What is Local estrogen (vaginal creams, rings, or tablets) nan used for?",Effectiveness: Effective in alleviating urogenital symptoms Side effects: - Vaginal discharge<br>- Irritation<br>- Burning or itching in the vaginal area.,Not specified,General Information
What is Fezolinetant 30 mg used for?,Effectiveness: nan Side effects: nan.,Neurokinin-3 receptor antagonist,General Information
What is Fezolinetant 45 mg used for?,Effectiveness: -0.2 Side effects: nan.,Neurokinin-3 receptor antagonist,General Information
What is Estradiol / DRSP 1 mg / 1 mg used for?,Effectiveness: NR Side effects: nan.,MHT - Menopausal Hormone Therapy,General Information
What is Estradiol / DRSP 1 mg/ 2 mg used for?,Effectiveness: -0.30§ Side effects: nan.,MHT - Menopausal Hormone Therapy,General Information
What is Estradiol / DRSP 1 mg / 3 mg used for?,Effectiveness: NR Side effects: nan.,MHT - Menopausal Hormone Therapy,General Information
What is Estradiol / Progesterone 1 mg / 100 mg used for?,Effectiveness: -0. 56†§  ? Side effects: nan.,MHT - Menopausal Hormone Therapy,General Information
What is Estradiol / Progesterone 0.5 mg / 100 mg used for?,Effectiveness: -0.34†§  ? Side effects: nan.,MHT - Menopausal Hormone Therapy,General Information
What is Estradiol / Progesterone 0.5 mg / 50 mg used for?,Effectiveness: -0.20† ? Side effects: nan.,MHT - Menopausal Hormone Therapy,General Information
What is Estradiol 0.5 mg used for?,Effectiveness: -0.3*§ Side effects: nan.,MHT - Menopausal Hormone Therapy,General Information
What is Venlafaxine 75 mg used for?,Effectiveness: -0.2* Side effects: nan.,SNRI,General Information
What is Estradiol / NETA 0.5 mg / 0.1 mg used for?,Effectiveness: P Side effects: nan.,MHT - Menopausal Hormone Therapy,General Information
What is Estradiol / NETA 0.5 mg / 0.25 mg used for?,Effectiveness: P Side effects: nan.,MHT - Menopausal Hormone Therapy,General Information
What is Estradiol / DYD 1 mg / 5 mg used for?,Effectiveness: NR Side effects: nan.,MHT - Menopausal Hormone Therapy,General Information
What is Estradiol / DYD 0.5 mg / 2.5 mg used for?,Effectiveness: NR Side effects: nan.,MHT - Menopausal Hormone Therapy,General Information
What is Estradiol / DRSP 0.5 mg / 0.25 mg used for?,Effectiveness: -0.80§ Side effects: nan.,MHT - Menopausal Hormone Therapy,General Information
What is Estradiol / DRSP 0.5 mg / 0.5 mg used for?,Effectiveness: -1.07§ Side effects: nan.,MHT - Menopausal Hormone Therapy,General Information
What is Estradiol Transdermal System 0.2 mg used for?,Effectiveness: NR Side effects: nan.,MHT - Menopausal Hormone Therapy,General Information
What is Estradiol Transdermal System 0.4 mg used for?,Effectiveness: NR Side effects: nan.,MHT - Menopausal Hormone Therapy,General Information
What is Desvenlafaxine 100 mg used for?,Effectiveness: -0.33§  ? Side effects: nan.,SNRI,General Information
What is Desvenlafaxine 150 mg used for?,Effectiveness: -0.09 ? Side effects: nan.,SNRI,General Information
What is Desvenlafaxine 200 mg used for?,Effectiveness: -0.25§ Side effects: nan.,SNRI,General Information
What is Escitalopram 10 mg used for?,Effectiveness: -0.22 Side effects: nan.,SSRI,General Information
What is Paroxetine 7.5 mg used for?,Effectiveness: -0.1† or -0.05† Side effects: nan.,SSRI,General Information
What is Gabapentin 900 mg used for?,Effectiveness: -11.8‡† Side effects: nan.,Anticonvulsant ?,General Information
What is Gabapentin Gastroretentive 1800 mg used for?,Effectiveness: -0.19 Side effects: nan.,Gabapentin,General Information
What is fezolinetant 45mg used for?,"Effectiveness: -1.5 Side effects: Headache; in larger doses, elevated liver enzymes (ALT and AST). Important: Current use of a prohibited therapy (any pharmacologic treatment for VMS), known substance or alcohol use disorder, history of suicide attempt, previous/current history of malignant tumor, high systolic (≥ 130 mmHg) or diastolic (≥80 mmHg) blood pressure, severe allergy or intolerance to drugs, presence of disordered proliferative endometrium, endometrial hyperplasia, or endometrial cancer, or has any other medical disorder that could confound study outcome.",fezolinetant,General Information
What is DRSP 1mg used for?,"Effectiveness: nan Side effects: Uterine bleeding (more reports of various serious adverse events). Important: Contraindications for MHT, treatment with anticoagulant medications, recent use of oral, transdermal, or transvaginal hormonal preparations. Past medical history for cardiovascular disease, depression, diabetes, hypertension, or other diseases that could affect the study results.",DSRP,General Information
What is DRSP 2mg used for?,Effectiveness: nan Side effects: Uterine bleeding (more reports of various serious adverse events).,DSRP,General Information
What is DRSP 3mg used for?,Effectiveness: nan Side effects: Uterine bleeding (more reports of various serious adverse events).,DSRP,General Information
What is Estradiol and NETA 0.5 mg and1 mg used for?,"Effectiveness: nan Side effects: nan. Important: Recent exposure to MHT. Suspected or previous history of breast cancer or estrogen- dependent neoplasia, untreated endometrial hyperplasia and abnormal genital bleeding. History of diabetes mellitus, hypertension, any thrombo-embolic conditions and hepatic or renal impairment.",Estradiol and NETA,General Information
What is Estradiol and NETA 0.5 mg and 0.25 mg used for?,"Effectiveness: nan Side effects: nan. Important: Recent exposure to MHT. Suspected or previous history of breast cancer or estrogen- dependent neoplasia, untreated endometrial hyperplasia and abnormal genital bleeding. History of diabetes mellitus, hypertension, any thrombo-embolic conditions and hepatic or renal impairment.",Estradiol and NETA,General Information
What is Paroxetine 7.5 mg used for?,"Effectiveness: nan Side effects: Nausea, fatigue.",Paroxetine,General Information
What is Gabapentin 1800 mg used for?,"Effectiveness: -3.1 Side effects: Dizziness, headache, and somnolence. Important: Current treatment with MHT; history of gastric reduction; substance abuse within the past year; or any serious medical condition. Concomitant treatment of hot flashes except antidepressant with unchanged dosages were permitted.",Gabapentin,General Information